{
  "version": "1.0",
  "type": "handoff",
  "reason": "session_end",
  "generatedAt": "2026-09-19T02:35:42.295Z",
  "repoRoot": "/home/user/Updog_restore",
  "worktreePath": null,
  "branch": "claude/cool-edison-8nj70s",
  "headSha": "e28536e1acb07242f5b23ee09daf7b7bbf4e23aa",
  "upstream": "origin/claude/cool-edison-8nj70s",
  "dirty": true,
  "gitStatusPorcelain": "?? docs/superpowers/plans/2026-09-19-bug-prospector-proactive-error-hunt-handoff.md",
  "gitStatusHash": "b3f54becb6c618d4112bda4fac950f74ab32985e751840afeb80ec1391bb7432",
  "lastCommit": {
    "sha": "e28536e1acb07242f5b23ee09daf7b7bbf4e23aa",
    "subject": "docs(research): add bug-echo report for missing Idempotency-Key client callers"
  },
  "tests": {
    "status": "pass",
    "commands": [
      "npm run check",
      "npm run lint",
      "npm run phoenix:truth",
      "npm test"
    ],
    "summary": "check 0 new TS errors; lint + 11 guardrails clean; phoenix:truth 20 files/363 cases; unit 1196 files passed, 1 env-only failure (supertest-loopback needs IPv6), 6 skipped"
  },
  "resume": {
    "ttlMinutes": 10080,
    "expiresAt": "2026-09-26T02:35:42.295Z",
    "staleIf": [
      "head_sha_changed",
      "branch_changed",
      "git_status_hash_changed",
      "ttl_expired"
    ],
    "onStale": "rederive_state_from_repo_then_refresh_artifact_before_continuing"
  },
  "currentState": "Session 2026-09-19 (session_01CYDH7gafR9atXfRTw6VNbD) completed three deliverables on branch claude/cool-edison-8nj70s, all committed and pushed: (1) TRIP-review codebase audit docs/3-code-review/CR_w9_v1.6.0_codebase-audit.md, verdict NEEDS REVISION, 1 Critical (Add Company dialog omits Idempotency-Key) and 5 Major (CI Gate Status red on main for 12 pushes; PR gate skips integration lanes; inert per-request idempotency wrapper in server/server.ts:256; routers without idempotency on makeApp; last-writer-wins deal updates); (2) bug-echo report .agents/research/2026-09-19-bug-echo-missing-idempotency-key-header.md finding two more header-less client callers (AddDealModal, ImportDealsModal) and the test-code echo keeping CI red; (3) this handoff. No fixes applied. main is at d9f32c0c.",
  "nextTask": "Fresh session: run the bug-prospector skill (SKILL.md attached to the kickoff message; not in repo) following docs/superpowers/plans/2026-09-19-bug-prospector-proactive-error-hunt-handoff.md. Tier A scope with all 7 lenses first (actuals publication and preview services, capital-planning calculators, capital-plan scenario modal, nullable-valuation consumers from #1549, deal-pipeline bulk operations, BullMQ workers and current-forecast shadow trigger), then Tier B. Report only; write one report per tier under .agents/research/, commit and push, end with a phased implementation plan.",
  "blockers": [
    "bug-prospector SKILL.md is not committed in the repo and cannot be committed verbatim (it contains emoji rating glyphs the pre-commit hook rejects); attach it to the kickoff message.",
    "P0 fixes from the w9 audit (send Idempotency-Key from three dialogs; remove deleted CohortEngine paths from validate:core and calc-gate:full) are still open; main CI stays red until they land. They are separate from the bug-prospector run."
  ],
  "filesInFlight": [],
  "openQuestions": [
    "Whether to commit an emoji-free copy of the bug-prospector skill under .claude/skills/ (would need npm run skills:index) or keep attaching it per session.",
    "Whether the owner wants the P0 fixes opened as a PR before or after the bug-prospector run."
  ],
  "notes": [
    "Audit and bug-echo records live on branch claude/cool-edison-8nj70s until merged; read with git show origin/claude/cool-edison-8nj70s:<path>.",
    "Local gates on d9f32c0c: npm run check 0 new errors; npm run lint clean with 11 guardrails; phoenix:truth 363/363; full unit suite 16,461 passed, 90 skipped, 1 environment-only failure (IPv6 loopback).",
    "This artifact will read head_sha_changed after the handoff document is committed; the long-form document is the source of truth and says what to re-derive."
  ]
}
